{"action":{"aim_index":900,"angle":1.5707963267948966,"balls":1,"delay":0,"kind":"shot"},"category":"completion","completion":{"completed":true,"max_steps":3600,"reason":"fell_out","rule":"bench","steps":80},"format":"peggle.fixture","id":"completion_miss_fell_out","kind":"shot","result":{"balls":1,"balls_spawned":0,"bonus":0,"is_fever":false,"multiplier":1,"peg_score":0,"pegs_hit":0,"reds_hit":0,"score":0,"style_points":0,"styles":{}},"schema_version":1,"seed":{"level_seed":345,"type_counts":{"blue":0,"green":1,"purple":0,"red":1}},"source":{"config_sha256":"455757c900c604563865b5195eda2f31cfeba3d8666b6d782390e38c47e91d4d","level":"long_shot","level_sha256":"e2e0c728beec6a97ec83a926725e33de5954722ea025f865f765e6fe2ca1d880","reference_revision":"d17f6e7089b6e761f4367fc6a6dcd5b4da0309b9","reference_tree":"3dc7ddfe19916e149d2531b20c73463c28a202c8"}}
