{"action":{"kind":"scenario","name":"probe_depenetration_band_exit"},"category":"overlap_correction","completion":{"completed":true,"max_steps":1,"reason":"probe_complete","rule":"scenario","steps":1},"format":"peggle.fixture","id":"probe_depenetration_band_exit","kind":"scenario","result":{"inner_ball_radius":93.899999999999977,"inner_contact_kinds":["overlap"],"inner_exits_inward":true,"outer_ball_radius":126.10000000000002,"outer_contact_kinds":["overlap"],"outer_exits_outward":true},"schema_version":1,"seed":{"level_seed":1,"type_counts":{"green":0,"red":0}},"source":{"config_sha256":"455757c900c604563865b5195eda2f31cfeba3d8666b6d782390e38c47e91d4d","reference_revision":"d17f6e7089b6e761f4367fc6a6dcd5b4da0309b9","reference_tree":"3dc7ddfe19916e149d2531b20c73463c28a202c8"}}
