{"action":{"aim_index":900,"angle":1.5707963267948966,"balls":1,"delay":0,"kind":"shot"},"category":"shape_boundary","completion":{"completed":true,"max_steps":3600,"reason":"fell_out","rule":"bench","steps":284},"format":"peggle.fixture","id":"squiggly_annular_drop","kind":"shot","result":{"balls":1,"balls_spawned":0,"bonus":0,"is_fever":false,"multiplier":1,"peg_score":160,"pegs_hit":4,"reds_hit":0,"score":160,"style_points":0,"styles":{}},"schema_version":1,"seed":{"level_seed":20260918,"type_counts":{"blue":180,"green":2,"purple":0,"red":10}},"source":{"config_sha256":"455757c900c604563865b5195eda2f31cfeba3d8666b6d782390e38c47e91d4d","level":"squiggly_circle","level_sha256":"85620cf9823590757c303599fa37f0ee074d8ae53404074f0d610e51fa28fdb9","reference_revision":"d17f6e7089b6e761f4367fc6a6dcd5b4da0309b9","reference_tree":"3dc7ddfe19916e149d2531b20c73463c28a202c8"},"trace":{"events":284,"path":"fixtures/traces/squiggly_annular_drop.jsonl","sha256":"a778713c8144857d7e0d283ca3afd0b7f8e174639eb45d682b1da8cbfaa7d555"}}
