{"action":{"aim_index":53,"angle":0.092502450355699456,"balls":1,"delay":0,"kind":"shot"},"category":"clearing","completion":{"completed":true,"max_steps":7200,"reason":"fell_out","rule":"clearing","steps":183},"format":"peggle.fixture","id":"clearing_cascade","kind":"shot","result":{"balls":1,"balls_spawned":2,"bonus":10000,"is_fever":false,"multiplier":1,"peg_score":1440,"pegs_hit":6,"reds_hit":2,"score":11440,"style_points":0,"styles":{}},"schema_version":1,"seed":{"level_seed":123,"type_counts":{"blue":13,"green":2,"purple":0,"red":10}},"source":{"config_sha256":"455757c900c604563865b5195eda2f31cfeba3d8666b6d782390e38c47e91d4d","level":"circle_level","level_sha256":"a8c87a0976927b7f49ce17c3f58d48bf7cd8428416dcda012bd0ad307c82ef91","reference_revision":"d17f6e7089b6e761f4367fc6a6dcd5b4da0309b9","reference_tree":"3dc7ddfe19916e149d2531b20c73463c28a202c8"},"trace":{"events":183,"path":"fixtures/traces/clearing_cascade.jsonl","sha256":"bac657f168e133078aa6770d0d5223e031f5d977f03dff944c91704c0f83fdd8"}}
