{"action":{"aim_index":503,"angle":0.87790061375314776,"balls":1,"delay":0,"kind":"shot"},"category":"line_metadata","completion":{"completed":true,"max_steps":3600,"reason":"fell_out","rule":"bench","steps":721},"format":"peggle.fixture","id":"slide_line_metadata","kind":"shot","result":{"balls":1,"balls_spawned":0,"bonus":0,"is_fever":false,"multiplier":1,"peg_score":4840,"pegs_hit":22,"reds_hit":0,"score":9840,"style_points":5000,"styles":{"slide":1}},"schema_version":1,"seed":{"level_seed":1,"type_counts":{"blue":73,"green":0,"purple":0,"red":0}},"source":{"config_sha256":"455757c900c604563865b5195eda2f31cfeba3d8666b6d782390e38c47e91d4d","level":"slide","level_sha256":"8432b14c888aaa7746aa9ca5fe65ffba5b52f5fe552fc7cd513b25fe92d960a7","reference_revision":"d17f6e7089b6e761f4367fc6a6dcd5b4da0309b9","reference_tree":"3dc7ddfe19916e149d2531b20c73463c28a202c8"}}
