{"action":{"kind":"scenario","name":"probe_depenetration_inner_wall"},"category":"overlap_correction","completion":{"completed":true,"max_steps":1,"reason":"probe_complete","rule":"scenario","steps":1},"format":"peggle.fixture","id":"probe_depenetration_inner_wall","kind":"scenario","result":{"after":8718.7999999999993,"before":8718.9300000000003,"contact_kinds":["overlap"],"final":{"vx":0,"vy":0,"x":9318.7999999999993,"y":950},"inside_hole":true,"moved":0.13000000000101863},"schema_version":1,"seed":{"level_seed":1,"type_counts":{"green":0,"red":0}},"source":{"config_sha256":"455757c900c604563865b5195eda2f31cfeba3d8666b6d782390e38c47e91d4d","reference_revision":"d17f6e7089b6e761f4367fc6a6dcd5b4da0309b9","reference_tree":"3dc7ddfe19916e149d2531b20c73463c28a202c8"}}
