{"action":{"kind":"scenario","name":"probe_near_tie_equal_toi"},"category":"near_tie","completion":{"completed":true,"max_steps":163,"reason":"probe_complete","rule":"scenario","steps":163},"format":"peggle.fixture","id":"probe_near_tie_equal_toi","kind":"scenario","result":{"pegs_hit":2,"score":40,"scored_order":[1,2]},"schema_version":1,"seed":{"level_seed":1,"type_counts":{"green":0,"red":0}},"source":{"config_sha256":"455757c900c604563865b5195eda2f31cfeba3d8666b6d782390e38c47e91d4d","reference_revision":"d17f6e7089b6e761f4367fc6a6dcd5b4da0309b9","reference_tree":"3dc7ddfe19916e149d2531b20c73463c28a202c8"}}
