{"action":{"aim_index":0,"angle":0,"balls":1,"delay":0,"kind":"shot"},"category":"power","completion":{"completed":true,"max_steps":3600,"reason":"fell_out","rule":"bench","steps":1507},"format":"peggle.fixture","id":"m3_mustache_left_wall","kind":"shot","result":{"balls":1,"balls_spawned":2,"bonus":0,"is_fever":false,"multiplier":1,"peg_score":34500,"pegs_hit":30,"reds_hit":4,"score":39500,"style_points":5000,"styles":{"slide":1}},"schema_version":1,"seed":{"level_seed":20261011,"type_counts":{"blue":80,"green":3,"purple":0,"red":16}},"source":{"config_sha256":"a17e60b43b1437510a59ba59c8791b27600a4b7fd7d56bc5f9c18d3e94f114d9","level":"mustache","level_sha256":"ea33fadd70666980cf426fb4a2854f66c28d333fb9f1a57b15a282cfddd0f747","reference_revision":"da752257f613abbd209f1aa1acdd37a5f9be05f5","reference_tree":"61278edc5467bf8399c24f4af0fcf36d75cac6a2"},"trace":{"events":1507,"path":"fixtures/traces/m3_mustache_left_wall.jsonl","sha256":"1c4ef8a8d21eeeda50341af2bbac7fa2e623879a2fe140992b31277cedc5c629"}}
