{"action":{"kind":"scenario","name":"probe_graze_gap_0_75"},"category":"shape_boundary","completion":{"completed":true,"max_steps":53,"reason":"probe_complete","rule":"scenario","steps":53},"format":"peggle.fixture","id":"probe_graze_gap_0_75","kind":"scenario","result":{"contact_kinds":[],"event_count":0,"final":{"vx":0,"vy":400,"x":583.25,"y":502.98000000000087},"gap":0.75},"schema_version":1,"seed":{"level_seed":1,"type_counts":{"green":0,"red":0}},"source":{"config_sha256":"455757c900c604563865b5195eda2f31cfeba3d8666b6d782390e38c47e91d4d","reference_revision":"d17f6e7089b6e761f4367fc6a6dcd5b4da0309b9","reference_tree":"3dc7ddfe19916e149d2531b20c73463c28a202c8"}}
