{"action":{"kind":"scenario","name":"probe_annular_cap_crossing"},"category":"shape_boundary","completion":{"completed":true,"max_steps":26,"reason":"probe_complete","rule":"scenario","steps":26},"format":"peggle.fixture","id":"probe_annular_cap_crossing","kind":"scenario","result":{"angular_offset":0.20000000000000001,"cap_angle":-0.5,"cap_normal":{"x":-0.47942553860420301,"y":-0.87758256189037276},"cap_radius":44.102996002855875,"contact_kinds":["sweep"],"event_count":1,"events":[{"ball_id":1,"contact_kind":"sweep","did_bounce":true,"impact_x":635.82746698760195,"impact_y":273.59040201592956,"incoming_vx":119.85638465105075,"incoming_vy":219.39564047259319,"normal_x":-0.47942553860420301,"normal_y":-0.87758256189037276,"outgoing_vx":-95.885107720840637,"outgoing_vy":-175.51651237807459,"peg_id":1,"peg_shape":"annular","toi":0.70562877258666368,"type":"ball_contacted_peg"}],"final":{"vx":-95.885107720840637,"vy":-175.51651237807459,"x":595.44333344183178,"y":199.66774140840062},"start":{"x":634.41789842780202,"y":271.01020407430389},"surface":"cap","velocity":{"vx":119.85638465105075,"vy":219.39564047259319}},"schema_version":1,"seed":{"level_seed":1,"type_counts":{"green":0,"red":0}},"source":{"config_sha256":"455757c900c604563865b5195eda2f31cfeba3d8666b6d782390e38c47e91d4d","reference_revision":"d17f6e7089b6e761f4367fc6a6dcd5b4da0309b9","reference_tree":"3dc7ddfe19916e149d2531b20c73463c28a202c8"}}
