{"action":{"aim_index":7,"angle":0.012217304763960306,"balls":1,"delay":0,"kind":"shot"},"category":"style","completion":{"completed":true,"max_steps":3600,"reason":"fell_out","rule":"bench","steps":76},"format":"peggle.fixture","id":"off_the_wall_style","kind":"shot","result":{"balls":1,"balls_spawned":0,"bonus":0,"is_fever":false,"multiplier":1,"peg_score":500,"pegs_hit":1,"reds_hit":0,"score":5500,"style_points":5000,"styles":{"off_the_wall":1}},"schema_version":1,"seed":{"level_seed":345,"type_counts":{"blue":4,"green":2,"purple":0,"red":10}},"source":{"config_sha256":"455757c900c604563865b5195eda2f31cfeba3d8666b6d782390e38c47e91d4d","level":"off_the_wall","level_sha256":"be365d22c4d27341c63d631337183bf1d3a8bdb3c41c38b1b1c8a5344a35090a","reference_revision":"d17f6e7089b6e761f4367fc6a6dcd5b4da0309b9","reference_tree":"3dc7ddfe19916e149d2531b20c73463c28a202c8"}}
