{"action":{"aim_index":61,"angle":0.10646508437165411,"balls":1,"delay":0,"kind":"shot"},"category":"bucket","completion":{"completed":true,"max_steps":3600,"reason":"bucket_caught","rule":"bench","steps":117},"format":"peggle.fixture","id":"bucket_catch","kind":"shot","result":{"balls":1,"balls_spawned":0,"bonus":10000,"is_fever":false,"multiplier":1,"peg_score":40,"pegs_hit":2,"reds_hit":0,"score":10040,"style_points":0,"styles":{}},"schema_version":1,"seed":{"level_seed":123,"type_counts":{"blue":13,"green":2,"purple":0,"red":10}},"source":{"config_sha256":"455757c900c604563865b5195eda2f31cfeba3d8666b6d782390e38c47e91d4d","level":"circle_level","level_sha256":"a8c87a0976927b7f49ce17c3f58d48bf7cd8428416dcda012bd0ad307c82ef91","reference_revision":"d17f6e7089b6e761f4367fc6a6dcd5b4da0309b9","reference_tree":"3dc7ddfe19916e149d2531b20c73463c28a202c8"}}
