{"action":{"kind":"scenario","name":"probe_rectangle_corner_rotated"},"category":"shape_boundary","completion":{"completed":true,"max_steps":2,"reason":"probe_complete","rule":"scenario","steps":2},"format":"peggle.fixture","id":"probe_rectangle_corner_rotated","kind":"scenario","result":{"angle":0.59999999999999998,"contact_kinds":["sweep"],"corner":{"x":577.84686296785617,"y":296.96050668119608},"corner_local":{"x":-20,"y":10},"delta":3,"event_count":1,"events":[{"ball_id":1,"contact_kind":"sweep","did_bounce":true,"impact_x":572.43688776703232,"impact_y":299.55514891596994,"incoming_vx":451.71397871602829,"incoming_vy":-660.26849192774262,"normal_x":-0.90166253347061986,"normal_y":0.43244037246231243,"outgoing_vx":-672.728251145689,"outgoing_vy":-120.98223055665449,"peg_id":1,"peg_shape":"rectangle","toi":0.99970106829699834,"type":"ball_contacted_peg"}],"final":{"vx":-672.728251145689,"vy":-120.98223055665449,"x":572.42935920072046,"y":299.56615339083544},"start":{"x":557.38953423662542,"y":321.5498045856171},"start_offset":31.845500000000001,"velocity":{"vx":451.71397871602829,"vy":-660.26849192774262}},"schema_version":1,"seed":{"level_seed":1,"type_counts":{"green":0,"red":0}},"source":{"config_sha256":"455757c900c604563865b5195eda2f31cfeba3d8666b6d782390e38c47e91d4d","reference_revision":"d17f6e7089b6e761f4367fc6a6dcd5b4da0309b9","reference_tree":"3dc7ddfe19916e149d2531b20c73463c28a202c8"}}
