{"action":{"aim_index":1736,"angle":3.0298915814621559,"balls":1,"delay":0,"kind":"shot"},"category":"style","completion":{"completed":true,"max_steps":3600,"reason":"fell_out","rule":"bench","steps":306},"format":"peggle.fixture","id":"long_shot_style_fever","kind":"shot","result":{"balls":1,"balls_spawned":2,"bonus":300000,"is_fever":true,"multiplier":100,"peg_score":22000,"pegs_hit":2,"reds_hit":1,"score":323000,"style_points":1000,"styles":{"long_shot":1}},"schema_version":1,"seed":{"level_seed":345,"type_counts":{"blue":0,"green":1,"purple":0,"red":1}},"source":{"config_sha256":"455757c900c604563865b5195eda2f31cfeba3d8666b6d782390e38c47e91d4d","level":"long_shot","level_sha256":"e2e0c728beec6a97ec83a926725e33de5954722ea025f865f765e6fe2ca1d880","reference_revision":"d17f6e7089b6e761f4367fc6a6dcd5b4da0309b9","reference_tree":"3dc7ddfe19916e149d2531b20c73463c28a202c8"},"trace":{"events":306,"path":"fixtures/traces/long_shot_style_fever.jsonl","sha256":"f2161904d986eb851e685a54623fec98f542ba7490211b2d44c664103c7ba71a"}}
