{"action":{"aim_index":1046,"angle":1.8256143975860688,"balls":1,"delay":0,"kind":"shot"},"category":"style","completion":{"completed":true,"max_steps":3600,"reason":"bucket_caught","rule":"bench","steps":232},"format":"peggle.fixture","id":"lucky_bounce_style","kind":"shot","result":{"balls":1,"balls_spawned":0,"bonus":10000,"is_fever":false,"multiplier":2,"peg_score":2000,"pegs_hit":4,"reds_hit":4,"score":14500,"style_points":2500,"styles":{"lucky_bounce":1}},"schema_version":1,"seed":{"level_seed":345,"type_counts":{"blue":5,"green":0,"purple":0,"red":10}},"source":{"config_sha256":"455757c900c604563865b5195eda2f31cfeba3d8666b6d782390e38c47e91d4d","level":"lucky_bounce","level_sha256":"b8b508b00fca0e1e479afb55761e6e949b1995007fdad2ac77d1b5eee803f1e7","reference_revision":"d17f6e7089b6e761f4367fc6a6dcd5b4da0309b9","reference_tree":"3dc7ddfe19916e149d2531b20c73463c28a202c8"}}
