{"action":{"kind":"scenario","name":"probe_ball_ball_impulse"},"category":"multiball","completion":{"completed":true,"max_steps":5,"reason":"probe_complete","rule":"scenario","steps":5},"format":"peggle.fixture","id":"probe_ball_ball_impulse","kind":"scenario","result":{"a":{"vx":-160,"vy":0,"x":591.87612266666656,"y":300},"b":{"vx":160,"vy":0,"x":609.34399999999982,"y":300},"contact_kinds":["sweep"],"event_count":1},"schema_version":1,"seed":{"level_seed":1,"type_counts":{"green":0,"red":0}},"source":{"config_sha256":"455757c900c604563865b5195eda2f31cfeba3d8666b6d782390e38c47e91d4d","reference_revision":"d17f6e7089b6e761f4367fc6a6dcd5b4da0309b9","reference_tree":"3dc7ddfe19916e149d2531b20c73463c28a202c8"}}
