{"action":{"kind":"scenario","name":"probe_annular_outer_surface"},"category":"shape_boundary","completion":{"completed":true,"max_steps":90,"reason":"probe_complete","rule":"scenario","steps":90},"format":"peggle.fixture","id":"probe_annular_outer_surface","kind":"scenario","result":{"contact_kinds":["sweep"],"event_count":1,"events":[{"ball_id":1,"contact_kind":"sweep","did_bounce":true,"impact_x":656,"impact_y":300,"incoming_vx":-200,"incoming_vy":0,"normal_x":1,"normal_y":0,"outgoing_vx":160,"outgoing_vy":0,"peg_id":1,"peg_shape":"annular","toi":0.30000000000000082,"type":"ball_contacted_peg"}],"final":{"vx":160,"vy":0,"x":894.96413333333214,"y":300},"surface":"outer"},"schema_version":1,"seed":{"level_seed":1,"type_counts":{"green":0,"red":0}},"source":{"config_sha256":"455757c900c604563865b5195eda2f31cfeba3d8666b6d782390e38c47e91d4d","reference_revision":"d17f6e7089b6e761f4367fc6a6dcd5b4da0309b9","reference_tree":"3dc7ddfe19916e149d2531b20c73463c28a202c8"}}
