{"action":{"aim_index":80,"angle":0.13962634015954636,"balls":1,"delay":0,"kind":"shot"},"category":"power","completion":{"completed":true,"max_steps":3600,"reason":"fell_out","rule":"bench","steps":265},"format":"peggle.fixture","id":"ribbon_waves_ribbon","kind":"shot","result":{"balls":1,"balls_spawned":0,"bonus":0,"is_fever":false,"multiplier":1,"peg_score":900,"pegs_hit":6,"reds_hit":1,"score":900,"style_points":0,"styles":{}},"schema_version":1,"seed":{"level_seed":20261021,"type_counts":{"blue":107,"green":1,"purple":0,"red":25}},"source":{"config_sha256":"06c65f8f850c916748da08316a3e30b4e6b15abbfd57fe5e58f6aaeecca274ea","level":"ribbon_waves","level_sha256":"073b426e66c948895a73a5a45b96b4a5538332c8db2d5b1318f245f8ffe6f86e","reference_revision":"de49dabb19ecfe960885af6eda04a7a848864be4","reference_tree":"b463d9143b5385d4462a0cb8903ca412d6a02bf6"},"trace":{"events":265,"path":"fixtures/traces/ribbon_waves_ribbon.jsonl","sha256":"35e5bcd3e4c4c25aa3d71f3c06b066505fa68a1fe5920a9bc3e516080ef2f31e"}}
