{"action":{"aim_index":570,"angle":0.99483767363676778,"balls":1,"delay":0,"kind":"shot"},"category":"multiball","completion":{"completed":true,"max_steps":3600,"reason":"fell_out","rule":"bench","steps":1797},"format":"peggle.fixture","id":"m3_mustache_multiball","kind":"shot","result":{"balls":1,"balls_spawned":6,"bonus":10000,"is_fever":false,"multiplier":2,"peg_score":81600,"pegs_hit":60,"reds_hit":7,"score":91600,"style_points":0,"styles":{}},"schema_version":1,"seed":{"level_seed":20261011,"type_counts":{"blue":80,"green":3,"purple":0,"red":16}},"source":{"config_sha256":"a17e60b43b1437510a59ba59c8791b27600a4b7fd7d56bc5f9c18d3e94f114d9","level":"mustache","level_sha256":"ea33fadd70666980cf426fb4a2854f66c28d333fb9f1a57b15a282cfddd0f747","reference_revision":"da752257f613abbd209f1aa1acdd37a5f9be05f5","reference_tree":"61278edc5467bf8399c24f4af0fcf36d75cac6a2"},"trace":{"events":1797,"path":"fixtures/traces/m3_mustache_multiball.jsonl","sha256":"8d74f0c066b6cefe8f465a0fe8852382d0ef74348ae982e129599f2651ab64e7"}}
