{"action":{"aim_index":633,"angle":1.1047934165124107,"balls":1,"delay":0,"kind":"shot"},"category":"style","completion":{"completed":true,"max_steps":3600,"reason":"fell_out","rule":"bench","steps":345},"format":"peggle.fixture","id":"double_long_shot_style","kind":"shot","result":{"balls":1,"balls_spawned":0,"bonus":0,"is_fever":false,"multiplier":1,"peg_score":900,"pegs_hit":3,"reds_hit":3,"score":8900,"style_points":8000,"styles":{"double_long_shot":1,"long_shot":1,"super_long_shot":1}},"schema_version":1,"seed":{"level_seed":345,"type_counts":{"blue":0,"green":0,"purple":0,"red":12}},"source":{"config_sha256":"455757c900c604563865b5195eda2f31cfeba3d8666b6d782390e38c47e91d4d","level":"double_long_shot","level_sha256":"a290ed22f0ec8f542db5c6d938a76350e50a29925c6a435209fa716018a02774","reference_revision":"d17f6e7089b6e761f4367fc6a6dcd5b4da0309b9","reference_tree":"3dc7ddfe19916e149d2531b20c73463c28a202c8"}}
